{
  "entity_id": "in-space",
  "entity_type": "company",
  "tier": "C",
  "noindex": true,
  "slug": "in-space",
  "name": "IN-SPACe",
  "vertical": "space",
  "parent_hub_path": "/research/space/company/",
  "last_verified": "2026-08-30",
  "status": "Operational",
  "header": {
    "one_liner": "IN-SPACe dossier placeholder with initial sources.",
    "chips": [
      "B",
      "India-relevant"
    ],
    "maker": "IN-SPACe",
    "country": "India",
    "indigenous_pct": null,
    "indigenous_label": "Not applicable",
    "mobility_or_class": "Not documented",
    "operational_domains": []
  },
  "at_a_glance": {
    "Name": "IN-SPACe",
    "Type": "company",
    "Evidence": "Initial sources captured; India relevance may need deepening."
  },
  "what_it_is": {
    "prose": "IN-SPACe is the Indian National Space Promotion and Authorisation Centre under DoS.",
    "sources": [
      "src-insp-1"
    ]
  },
  "open_questions": [],
  "sources": [
    {
      "id": "src-insp-1",
      "title": "IN-SPACe homepage",
      "publisher": "IN-SPACe",
      "url": "https://www.inspace.gov.in/",
      "published_date": null,
      "trust_tier": "credible",
      "accessed": "2026-08-30",
      "note": "Regulator and authorisation body overview."
    }
  ],
  "seo": {
    "title": "IN-SPACe — Company · India Space Atlas | Techadyant",
    "meta_description": "IN-SPACe company/entity in the India Space Atlas.",
    "canonical_path": "/research/space/company/in-space/",
    "og_type": "article",
    "json_ld_types": [
      "WebPage",
      "BreadcrumbList"
    ]
  },
  "cta": {
    "track_ecosystem": "/research/space/",
    "submit_correction": "/research/space/submit-correction/",
    "related_research": [
      "/research/space/"
    ]
  },
  "faq": [],
  "timeline": [],
  "graph": {
    "maker_other_systems": [],
    "peer_systems": [],
    "related_components": [],
    "referenced_by": []
  }
}
