{
  "entity_id": "orbitaid-aerospace",
  "entity_type": "company",
  "tier": "B",
  "noindex": false,
  "slug": "orbitaid-aerospace",
  "name": "Orbitaid Aerospace",
  "vertical": "space",
  "parent_hub_path": "/research/space/company/",
  "last_verified": "2026-08-30",
  "status": "Operational",
  "header": {
    "one_liner": "Orbitaid Aerospace dossier placeholder with initial sources.",
    "chips": [
      "B",
      "India-relevant"
    ],
    "maker": "Orbitaid Aerospace",
    "country": "India",
    "indigenous_pct": null,
    "indigenous_label": "Not applicable",
    "mobility_or_class": "Not documented",
    "operational_domains": []
  },
  "at_a_glance": {
    "Name": "Orbitaid Aerospace",
    "Type": "company",
    "Evidence": "Initial sources captured; India relevance may need deepening."
  },
  "what_it_is": {
    "prose": "Orbitaid Aerospace evidence pending verification.",
    "sources": [
      "src-orb-1"
    ]
  },
  "open_questions": [],
  "sources": [
    {
      "id": "src-orb-1",
      "title": "Orbitaid Aerospace website",
      "publisher": "Orbitaid Aerospace",
      "url": "https://orbitaid.aero/",
      "published_date": null,
      "trust_tier": "credible",
      "accessed": "2026-08-30",
      "note": "Placeholder only."
    }
  ],
  "seo": {
    "title": "Orbitaid Aerospace — Company · India Space Atlas | Techadyant",
    "meta_description": "Orbitaid Aerospace company/entity in the India Space Atlas.",
    "canonical_path": "/research/space/company/orbitaid-aerospace/",
    "og_type": "article",
    "json_ld_types": [
      "WebPage",
      "BreadcrumbList"
    ]
  },
  "cta": {
    "track_ecosystem": "/research/space/",
    "submit_correction": "/research/space/submit-correction/",
    "related_research": [
      "/research/space/"
    ]
  },
  "faq": [],
  "timeline": [],
  "graph": {
    "maker_other_systems": [],
    "peer_systems": [],
    "related_components": [],
    "referenced_by": []
  }
}
